{
  "version": 3,
  "study_name": "something@moz",
  "branch": "totally-gnarly-1",
  "addon_version": "0.1.1",
  "shield_version": "1.2.3",
  "testing": true,
  "type": "shield-study-addon",
  "data": {
    "attributes": {
      "7": "E",
      "oe": "V5mr",
      "TuCi": "20",
      "q6": "pAZKPDA",
      "CXf3": "OjvYwwF",
      "c": "eLYaLg",
      "Om": "dYQ"
    }
  }
}
